{
  "schemaVersion": 1,
  "evidenceOrigin": "physical",
  "runId": "A",
  "buildSha": "REPLACE_WITH_40_HEX",
  "navigationPolicyVersion": "navigation-v2-rc-1",
  "navigationPolicySha256": "REPLACE_WITH_64_HEX",
  "deployedUrl": "https://REPLACE/",
  "deviceModel": "iPhone 15 Pro Max",
  "iosVersion": "REPLACE",
  "safariVersion": "REPLACE",
  "browserMode": "safari",
  "environment": "open-sky",
  "displayMode": "browser",
  "wakeLockSupported": true,
  "wakeLockSustained": true,
  "startedAt": "REPLACE_WITH_ISO_TIMESTAMP",
  "endedAt": "REPLACE_WITH_ISO_TIMESTAMP",
  "durationSeconds": 1200,
  "routeId": "REPLACE",
  "routeVersion": "REPLACE",
  "routeDigest": "REPLACE_WITH_64_HEX",
  "routeExpiresAt": "REPLACE_WITH_ISO_TIMESTAMP",
  "providerId": "REPLACE",
  "providerVersion": "REPLACE",
  "providerRightsDigest": "REPLACE_WITH_64_HEX",
  "providerExpiresAt": "REPLACE_WITH_ISO_TIMESTAMP",
  "checklistSha256": "REPLACE_WITH_64_HEX",
  "screensSha256": {
    "p1-permission-and-heading.png": "REPLACE_WITH_64_HEX"
  },
  "traceSha256": "REPLACE_WITH_64_HEX",
  "traceStoredPrivately": true,
  "rawTraceDisposition": "retained-private",
  "exactLocationPublished": false,
  "moderatorPresent": true,
  "gates": {
    "P1": { "status": "PASS", "observedAt": "REPLACE_WITH_ISO_TIMESTAMP", "notes": "REPLACE" },
    "P2": { "status": "PASS", "observedAt": "REPLACE_WITH_ISO_TIMESTAMP", "notes": "REPLACE" },
    "P3": { "status": "PASS", "observedAt": "REPLACE_WITH_ISO_TIMESTAMP", "notes": "REPLACE" },
    "P4": { "status": "PASS", "observedAt": "REPLACE_WITH_ISO_TIMESTAMP", "notes": "REPLACE" },
    "P5": { "status": "PASS", "observedAt": "REPLACE_WITH_ISO_TIMESTAMP", "notes": "REPLACE" },
    "P6": { "status": "PASS", "observedAt": "REPLACE_WITH_ISO_TIMESTAMP", "notes": "REPLACE" },
    "P7": { "status": "PASS", "observedAt": "REPLACE_WITH_ISO_TIMESTAMP", "notes": "REPLACE" }
  },
  "unsafeEvents": 0,
  "criticalDefects": 0,
  "testerAttestation": {
    "tester": "REPLACE",
    "moderator": "REPLACE",
    "signedAt": "REPLACE_WITH_ISO_TIMESTAMP",
    "signatureSha256": "REPLACE_WITH_64_HEX",
    "keyId": "REPLACE_WITH_APPROVED_KEY_ID",
    "signatureBase64": "REPLACE_WITH_ED25519_SIGNATURE"
  }
}
